Resolution ID,Resolution Name,Year
A/RES/76/161,Human rights and unilateral coercive measures : resolution / adopted by the General Assembly,2021
A/RES/76/160,Promotion of equitable geographical distribution in the membership of the human rights treaty bodies : resolution / adopted by the General Assembly,2021
A/RES/76/155,United Nations Human Rights Training and Documentation Centre for South-West Asia and the Arab Region : resolution / adopted by the General Assembly,2021
A/RES/76/166,The right to food : resolution / adopted by the General Assembly,2021
A/RES/76/165,Promotion of a democratic and equitable international order : resolution / adopted by the General Assembly,2021
A/RES/76/163,The right to development : resolution / adopted by the General Assembly,2021
